{
  "$schema": "https://raw.githubusercontent.com/jbabin91/super-claude/main/.claude-plugin/marketplace.schema.json",
  "name": "super-claude",
  "owner": {
    "name": "Jace Babin",
    "email": "jbabin91@gmail.com",
    "url": "https://github.com/jbabin91"
  },
  "metadata": {
    "version": "0.3.0",
    "description": "A comprehensive marketplace of Claude Code plugins for TanStack Start, Base UI, Hono, and modern TypeScript development. Install individual plugins or mix and match based on your project needs.",
    "repository": "https://github.com/jbabin91/super-claude",
    "homepage": "https://github.com/jbabin91/super-claude",
    "license": "MIT"
  },
  "plugins": [
    {
      "name": "meta",
      "source": "./plugins/meta",
      "description": "Create custom skills, commands, agents, hooks, and plugins. For plugin creators and power users extending Claude Code.",
      "version": "0.3.0",
      "category": "meta",
      "keywords": [
        "meta",
        "creator",
        "generator",
        "validation",
        "customization"
      ]
    },
    {
      "name": "workflow",
      "source": "./plugins/workflow",
      "description": "Development workflow enhancements including OpenSpec proposal management and skill auto-activation system.",
      "version": "0.1.3",
      "category": "workflow",
      "keywords": [
        "workflow",
        "openspec",
        "automation",
        "auto-activation",
        "hooks",
        "development"
      ]
    },
    {
      "name": "design-system",
      "source": "./plugins/design-system",
      "description": "Component libraries with Base UI, shadcn/ui, design tokens, WCAG AAA accessibility, and Storybook integration",
      "version": "0.1.0",
      "category": "frontend",
      "keywords": [
        "base-ui",
        "shadcn",
        "design-system",
        "accessibility",
        "storybook",
        "components"
      ]
    },
    {
      "name": "testing",
      "source": "./plugins/testing",
      "description": "Unit, integration, E2E testing with Vitest, Playwright, and runtime-agnostic patterns",
      "version": "0.1.0",
      "category": "quality",
      "keywords": ["testing", "vitest", "playwright", "e2e", "unit"]
    },
    {
      "name": "typescript",
      "source": "./plugins/typescript",
      "description": "TypeScript type checking, refactoring, import management, and type contracts",
      "version": "0.1.0",
      "category": "language",
      "keywords": ["typescript", "types", "refactoring", "imports"]
    },
    {
      "name": "git",
      "source": "./plugins/git",
      "description": "Git workflow automation: smart commits with gitmoji, PR descriptions, changelogs, worktrees",
      "version": "0.1.0",
      "category": "workflow",
      "keywords": ["git", "commits", "pr", "changelog", "worktrees"]
    },
    {
      "name": "devops",
      "source": "./plugins/devops",
      "description": "GitHub Actions, Docker, CI/CD pipelines, and deployment automation",
      "version": "0.1.0",
      "category": "devops",
      "keywords": ["devops", "github-actions", "docker", "ci-cd"]
    }
  ]
}
